{
  "format": "rubik.state",
  "version": 1,
  "size": 3,
  "faceOrder": [
    "U",
    "R",
    "F",
    "D",
    "L",
    "B"
  ],
  "colorScheme": {
    "U": "white",
    "R": "red",
    "F": "green",
    "D": "yellow",
    "L": "orange",
    "B": "blue"
  },
  "faces": {
    "U": [
      1,
      1,
      1,
      1,
      1,
      1,
      1,
      1,
      1
    ],
    "R": [
      2,
      2,
      2,
      2,
      2,
      2,
      2,
      2,
      2
    ],
    "F": [
      3,
      3,
      3,
      3,
      3,
      3,
      3,
      3,
      3
    ],
    "D": [
      4,
      4,
      4,
      4,
      4,
      4,
      4,
      4,
      4
    ],
    "L": [
      5,
      5,
      5,
      5,
      5,
      5,
      5,
      5,
      5
    ],
    "B": [
      6,
      6,
      6,
      6,
      6,
      6,
      6,
      6,
      6
    ]
  },
  "stateHash": "",
  "source": "solved-example",
  "createdUtc": "2026-07-16T00:00:00Z",
  "metadata": {
    "example": true
  }
}

